{
  "version": "ruby-woocommerce-final-confirmation-screen-evidence-v1",
  "evidence_id": "ruby-preproduction-gap-review-2026-09-16",
  "environment": "preproduction",
  "capture_method": "browser_screenshot_and_dom_notes",
  "captured_at": "2026-09-16T15:30:57Z",
  "source_url_class": "sanitized_preproduction_checkout",
  "synthetic_customer_data_only": true,
  "contains_personal_data": false,
  "contains_secret_material": false,
  "screen_capture_refs": [
    {
      "artifact_ref": "ops/evidence/ruby-actual-woocommerce-final-screen-2026-09-16-sanitized.jpg",
      "sha256": "e76cb899ca6e3d80df5329c78701a1eb83e9556c0860eb91db85fb6b67091d83",
      "redaction_applied": true,
      "contains_personal_data": false,
      "contains_secret_material": false
    }
  ],
  "observations": {
    "product_name_quantity_options_visible": true,
    "subtotal_shipping_total_visible": true,
    "payment_method_visible": true,
    "payment_timing_or_deadline_visible": true,
    "fulfillment_timing_visible": true,
    "cancellation_returns_terms_visible_or_linked": false,
    "correction_path_available_before_submission": true,
    "final_action_label_unambiguous": true,
    "final_action_not_invoked": true,
    "tokushoho_disclosure_visible_or_linked": false,
    "tax_display_matches_exempt_posture": true,
    "konbini_three_day_deadline_reconciled_when_selected": false
  },
  "authority": {
    "order_creation_authorized": false,
    "payment_execution_authorized": false,
    "production_publish_authorized": false,
    "catalog_mutation_authorized": false,
    "dns_cutover_authorized": false
  },
  "review_notes": [
    "Actual coming-soon WooCommerce preproduction checkout was reviewed with synthetic QA data.",
    "The final action was visible and was not invoked; no order or payment was created.",
    "Shipping displayed Free rather than the verified Yamato regional charge.",
    "Only manual order confirmation was exposed; the approved KOMOJU subset and Konbini three-day deadline were not reviewable.",
    "Cancellation and returns terms and the Tokushoho disclosure were not directly linked from the final screen.",
    "Evidence remains incomplete and the actual-screen acceptance gate remains RED fail-closed."
  ],
  "evidence_complete": false,
  "actual_final_confirmation_screen_reviewed": true
}
